{"claim_boundary":{"common_source_is_not_common_objective":true,"higher_reduction_is_not_cross_layer_superiority":true,"structural_is_not_behavioral":true},"comparison_result":"NOT_ESTABLISHED","cross_lane_isolation":{"assembled_after_lane_c_qualification":true,"missing_values_explicit":"NOT_ESTABLISHED","public_content_free_receipts_only":true,"run_1_input_lanes":["SHARED_BEFORE_ONLY"],"run_2_input_lanes":["C_EXACT_NOTE_AND_RECEIPTS_ONLY"]},"lanes":[{"after_identity":{"result":"NOT_ESTABLISHED","value":null},"common_before_binding":{"result":"NOT_ESTABLISHED","value":null},"lane_id":"A_COMPACTOR","qualification":{"result":"NOT_ESTABLISHED","value":null},"reduction":{"result":"NOT_ESTABLISHED","value":null},"tool_identity":{"result":"NOT_ESTABLISHED","value":null},"version_identity":{"result":"NOT_ESTABLISHED","value":null}},{"after_identity":{"line_count":359,"result":"PASS","sha256":"bb14c77c6b45c6bf365902b47729b455df566fa98688956824e072c352f2dae7","utf8_byte_count":11147},"common_before_binding":{"result":"PASS","sha256":"e856160413a9d47622779dede6a2eeca9fd027284d815b155ab6e323a74863db"},"lane_id":"B_HISTORICAL_HUMAN_AI_MANUAL","qualification":{"b01_b10_receipt":"NOT_ESTABLISHED","behavior":"NOT_ESTABLISHED","class":"CANONICAL_MANUAL_TEXTUAL_RESTRUCTURING_ONLY"},"reduction":{"approximate_percentage":"46.16%","byte_count":9558,"fraction":"0.461628","line_count":158,"result":"PASS"}},{"a1":{"result":"NOT_ESTABLISHED","value":null},"a2":{"result":"NOT_ESTABLISHED","value":null},"a3_exact_reuse":{"result":"NOT_ESTABLISHED","value":null},"after_identity":{"result":"NOT_ESTABLISHED","value":null},"b01_b10":{"result":"NOT_ESTABLISHED","value":null},"behavior":{"result":"NOT_ESTABLISHED","value":null},"common_before_binding":{"result":"PASS","sha256":"e856160413a9d47622779dede6a2eeca9fd027284d815b155ab6e323a74863db"},"explicit_non_claims":["Independence does not establish absence of latent model memory.","Shorter does not mean better.","A higher reduction rate does not establish a superior system across layers.","Structural presence does not establish behavior preservation.","A3 does not establish usefulness, safety, or generality.","A common Before does not establish identical objectives across lanes.","V13 is not only a compressor.","Public usefulness and cross-tool superiority are not established."],"independence":{"result":"NOT_ESTABLISHED","value":null},"lane_id":"C_V13_CREATOR_LIVE","public_safety":{"result":"NOT_ESTABLISHED","value":null},"reduction":{"result":"NOT_ESTABLISHED","value":null},"retry_replacement":"NOT_AUTHORIZED"}],"schema":"decision-os.creator-live-agents-common-before-comparison.v0.1","shared_before":{"git_blob":"f85b0d9b17a8f90a7128ea96d9c8f63a88022128","line_count":517,"logical_artifact":"AGENTS.md","sha256":"e856160413a9d47622779dede6a2eeca9fd027284d815b155ab6e323a74863db","source_revision":"21cd88d4efb378a60cd08a28712083d9d4a8bc19","utf8_byte_count":20705,"virtual_path":"before/AGENTS.md"}}
